{
  "schema": "lattice.agents/index/v1",
  "audience": "agents",
  "subject": "Orleans.Lattice",
  "conventions": {
    "encoding": "ascii, lf line endings, 2-space indent, trailing newline",
    "determinism": "no timestamps, commit hashes or release numbers; entity lists sorted by id (ordinal) except semantically ordered lists",
    "ids": "kebab-case; cross-file references use ids",
    "source_reference": {
      "format": "repo/relative/path#Symbol",
      "symbol": "optional; every dot-separated segment occurs in the file",
      "resolves_against": "https://github.com/NSTA1/Orleans.Lattice at the ref the site was built from"
    },
    "uncertainty_marker": {
      "status_value": "uncertain",
      "keys": [
        "status",
        "reason",
        "required_source",
        "issue"
      ],
      "required_keys": [
        "status",
        "reason",
        "required_source"
      ],
      "issue": "GitHub issue number tracking the gap, when filed"
    },
    "package_ids": "NuGet package ids in published casing",
    "transport_scope": [
      "both",
      "grpc_only",
      "in_process_only",
      "mcp_tool"
    ],
    "grpc_method": "/<service>/<Method>",
    "validation": "test/lattice/Docs/AgentDocsConsistencyTests.cs",
    "empty_list": "the entity sources, read in full, state none",
    "configuration_property": "deployment.yaml configuration_schema[].properties[] is {name, type, default, source} plus optional validation and environment_variable; environment_variable is the exact process environment variable that binds the property, or an angle-bracket placeholder pattern for a prefix family",
    "error_reference": "operations[].errors[].error_id resolves to an id in the error_taxonomy of the same file",
    "decision_tree": {
      "node": "{id, check, on_true, on_false, source}; the first node is the root",
      "terminal": "{id, outcome}; every on_true/on_false target is a node id or a terminal id; terminals sorted by id"
    },
    "deprecated": {
      "shape": "{diagnostic, replacement, removal, migration}; diagnostic and migration optional",
      "replacement": "an operation id in the same file, or 'api/<surface>.json#<operation-id>'",
      "coverage": "no published operation or MCP tool may outlive a removed LATTICE0002 facade member or tool alias; the consistency tests remove retired operations from the specs and reserve the diagnostic id for history only"
    },
    "mcp_tool": {
      "tool_annotations": "{read_only, destructive, source} mirror the ReadOnly and Destructive hints of the MCP tool registration",
      "facade_operation": "null, 'api/<surface>.json#<operation-id>', or a list when a request parameter selects between facade operations",
      "inheritance": "with a single facade_operation string, retry, idempotency and concurrency are copied verbatim from that facade operation",
      "read_only": "a read_only tool is idempotent and safe to retry"
    },
    "availability": {
      "rule": "The specifications describe every surface Lattice ships, but a host exposes only the packages it registers. A surface or tool missing from a host is host configuration, not a fault: read availability before relying on a surface, confirm an MCP tool by its presence in the session's tools/list, and never emulate an unavailable operation through a different surface.",
      "api_surface": "api/<surface>.json availability is {in_process, requires, grpc_server, grpc_client, absent}: in_process, grpc_server and grpc_client list registration entries {registration, package, provides?, source}, where provides names the interfaces a registration makes resolvable and source is the declaration of that registration method; requires lists {name, kind (registration or options), arguments?, reason, source} that the surface needs as well; an empty grpc_server means the surface has no gRPC binding; absent states what a caller observes when the surface is not registered, or is null when no source states it.",
      "mcp_tool": "api/mcp.json operations[].availability is {module, package, opt_in, requires, source}: module is the registration that contributes the tool, opt_in names the parameter or option that must also be set (null when registering the module is enough), requires lists the facade registrations the tool delegates to, and source is the code that declares the tool. The session's tools/list is further filtered to the caller's effective permissions.",
      "procedure": "The first precondition of every procedure has id surface-available, and its failure_modes include surface-not-available."
    },
    "json_schemas": "schemas/<kind>.schema.json is the JSON Schema (draft 2020-12) of every artifact whose schema id is lattice.agents/<kind>/v1, including index.json (kind index). YAML artifacts validate after YAML 1.2 core-schema typing of plain scalars; a quoted scalar is a string.",
    "page_agent_spec": "User-facing Markdown pages declare agent_spec in YAML front matter: a site-root-relative path beginning docs/agents/ to a manifest-listed raw specification. The site preserves it as an absolute URL in Markdown alternates and announces it with rel=describedby and the correct JSON or YAML media type. Pages without a pointer use docs/agents/index.json."
  },
  "coverage": {
    "api_surfaces_covered": [
      "apps",
      "auth",
      "backup",
      "data",
      "lattice",
      "mcp",
      "replication",
      "schema",
      "state",
      "telemetry",
      "tenantadmin",
      "treeadmin"
    ],
    "api_surfaces_not_covered": [
      {
        "package": "Orleans.Lattice.GrainIndex",
        "reason": "in-process extension api; described in concepts.yaml and capabilities.yaml only"
      },
      {
        "package": "Orleans.Lattice.Vector",
        "reason": "in-process extension api; described in concepts.yaml and capabilities.yaml only"
      }
    ]
  },
  "artifacts": [
    {
      "path": "api/apps.json",
      "kind": "api",
      "format": "json",
      "schema": "lattice.agents/api/v1",
      "summary": "Installable-apps facades (Orleans.Lattice.Api.Apps, .Grpc): app control, role bindings, catalogue, workspace and app bridge operations, request/response types, errors and gRPC status, retry, idempotency, concurrency."
    },
    {
      "path": "api/auth.json",
      "kind": "api",
      "format": "json",
      "schema": "lattice.agents/api/v1",
      "summary": "Auth facade (Orleans.Lattice.Api.Auth, .Grpc): operations, request/response types, errors and gRPC status, retry, idempotency, concurrency."
    },
    {
      "path": "api/backup.json",
      "kind": "api",
      "format": "json",
      "schema": "lattice.agents/api/v1",
      "summary": "Backup facade (Orleans.Lattice.Api.Backup, .Grpc): catalog reads and accept-then-poll capture, restore, health-check and catalog-maintenance operations, request/response types, errors and gRPC status, retry, idempotency, concurrency."
    },
    {
      "path": "api/data.json",
      "kind": "api",
      "format": "json",
      "schema": "lattice.agents/api/v1",
      "summary": "Data facade (Orleans.Lattice.Api.Data, .Grpc): operations, request/response types, errors and gRPC status, retry, idempotency, concurrency."
    },
    {
      "path": "api/lattice.json",
      "kind": "api",
      "format": "json",
      "schema": "lattice.agents/api/v1",
      "summary": "Core in-process API (ILattice, ILatticeAdmin in Orleans.Lattice): operations, types, exceptions, retry, idempotency, concurrency."
    },
    {
      "path": "api/mcp.json",
      "kind": "api",
      "format": "json",
      "schema": "lattice.agents/api/v1",
      "summary": "MCP tool surface (Orleans.Lattice.Api.Mcp, .Telemetry, .Telemetry.Azure, .RepoContext, .RepoContext.Replication, .Apps): registration, authorization gate, session tool discovery, and every tool with the module and opt-in that contribute it, parameters, results, errors, tool annotations and the facade operation it delegates to."
    },
    {
      "path": "api/replication.json",
      "kind": "api",
      "format": "json",
      "schema": "lattice.agents/api/v1",
      "summary": "Replication facade and peer-status facade (Orleans.Lattice.Api.Replication, .Grpc) and operator re-seed admin and dead-letter queue (Orleans.Lattice.Replication): operations, request/response types, errors and gRPC status, retry, idempotency, concurrency."
    },
    {
      "path": "api/schema.json",
      "kind": "api",
      "format": "json",
      "schema": "lattice.agents/api/v1",
      "summary": "Schema facade (Orleans.Lattice.Api.Schema, .Grpc): operations, request/response types, errors and gRPC status, retry, idempotency, concurrency."
    },
    {
      "path": "api/state.json",
      "kind": "api",
      "format": "json",
      "schema": "lattice.agents/api/v1",
      "summary": "State facade (Orleans.Lattice.Api.State, .Grpc): operations, request/response types, errors and gRPC status, retry, idempotency, concurrency."
    },
    {
      "path": "api/telemetry.json",
      "kind": "api",
      "format": "json",
      "schema": "lattice.agents/api/v1",
      "summary": "Telemetry facade (Orleans.Lattice.Api.Telemetry, .Grpc): operations, request/response types, errors and gRPC status, retry, idempotency, concurrency."
    },
    {
      "path": "api/tenantadmin.json",
      "kind": "api",
      "format": "json",
      "schema": "lattice.agents/api/v1",
      "summary": "Tenant administration facade (Orleans.Lattice.Api.TenantAdmin, .Grpc): operations, request/response types, errors and gRPC status, retry, idempotency, concurrency."
    },
    {
      "path": "api/treeadmin.json",
      "kind": "api",
      "format": "json",
      "schema": "lattice.agents/api/v1",